{
  "schemaVersion": "sacs-v06-progressive-status/1.0",
  "sourceSha": "0000000000000000000000000000000000000000",
  "updatedAt": "2026-01-01T00:00:00Z",
  "development": "NOT_STARTED",
  "realWsgsIntegration": "NOT_STARTED",
  "release": "NOT_REQUESTED",
  "markers": [
    "SACS_WSGS_NATIVE_ANALYSIS_CONTROL_DEFERRED"
  ],
  "pendingReasons": [],
  "hardFailures": []
}
